{
  "altarCare": {
    "publicId": "ps-altar-0001",
    "slug": "thiet-lap-va-bao-duong-phat-dai",
    "title": "Thiet Lap Phat Dai Va Bao Duong",
    "locationRules": [
      {
        "ruleCode": "clean-bright-near-window",
        "label": "Vi tri sach va sang",
        "description": "Dat ban tho noi sach se, sang sua, uu tien gan cua so nhung co diem tua vung.",
        "severity": "critical"
      },
      {
        "ruleCode": "avoid-kitchen-toilet-opposite",
        "label": "Tranh vi tri xung",
        "description": "Khong dat doi dien bep, gan nha ve sinh, duoi may lanh, tren TV/tu lanh.",
        "severity": "critical"
      },
      {
        "ruleCode": "cabinet-fallback",
        "label": "Giai phap tu co cua",
        "description": "Neu khong gian han che, dung tu go co cua, mo khi dang huong, dong khi xong.",
        "severity": "warning"
      }
    ],
    "placementRules": [
      {
        "ruleCode": "guanyin-center",
        "label": "Quán Thế Âm ở trung tâm",
        "description": "Khi thờ nhiều vị theo pháp môn, giữ trật tự vị trí canon, Quán Thế Âm ở giữa.",
        "severity": "critical"
      },
      {
        "ruleCode": "statue-height",
        "label": "Do cao ton tuong",
        "description": "Tuong/anh dat cao hon tam mat mot chut.",
        "severity": "info"
      }
    ],
    "offeringRules": {
      "water": [
        {
          "ruleCode": "one-cup-per-bodhisattva",
          "label": "Moi vi mot coc rieng",
          "description": "Nuoc sach, coc tron trang, thay nuoc hang ngay; khong uong truc tiep tu coc cung.",
          "severity": "critical"
        }
      ],
      "oilLamp": [
        {
          "ruleCode": "vegetable-oil-only",
          "label": "Dung dau thuc vat",
          "description": "Dung dau olive/bap/hat cai; tranh dau mui manh.",
          "severity": "critical"
        },
        {
          "ruleCode": "extinguish-before-incense-end",
          "label": "Tat den truoc khi huong tan",
          "description": "Tat bang nap day, khong thoi mieng.",
          "severity": "critical"
        }
      ],
      "fruit": [
        {
          "ruleCode": "odd-count-per-layer",
          "label": "So le tren moi tang",
          "description": "Xep trai cay theo nguyen tac so le tren moi tang dia.",
          "severity": "warning"
        }
      ],
      "flowers": [
        {
          "ruleCode": "avoid-thorny-flowers",
          "label": "Tranh hoa co gai",
          "description": "Khong dat hoa co gai/chau cay co dat len ban tho.",
          "severity": "warning"
        }
      ],
      "incense": [
        {
          "ruleCode": "fixed-offering-time",
          "label": "Gio dang huong co dinh",
          "description": "Dang huong deu dan theo khung gio co dinh, ngay dac biet co the tang muc dang huong.",
          "severity": "info"
        }
      ]
    },
    "maintenanceSteps": [
      { "stepNumber": 1, "title": "Kiem tra vat pham", "action": "Thay nuoc, hoa, trai cay moi truoc khi di xa." },
      { "stepNumber": 2, "title": "Lau don nhe", "action": "Lau nhe ban ngay bang khan sach, tranh cham vao tuong tuy tien." },
      { "stepNumber": 3, "title": "Bao tri den dau", "action": "Bo sung dau, tat dung cach, khong de den vuot quy tac." }
    ],
    "specialCases": [
      {
        "ruleCode": "travel-with-photo",
        "label": "Di xa mang anh ban tho",
        "description": "Co the chup anh ban tho (khi khong dang huong), boc vai do de duyn tri Tam Huong.",
        "severity": "info"
      },
      {
        "ruleCode": "move-home-sequence",
        "label": "Thu tu khi chuyen nha",
        "description": "Thinh ban tho theo nghi thuc, uu tien lap ban tho o nha moi som.",
        "severity": "critical"
      }
    ],
    "updatedAt": "2026-03-29T12:00:00Z"
  },
  "littleHouseWritingRules": {
    "publicId": "ps-lhw-0001",
    "slug": "quy-tac-viet-va-cham-do-nnn",
    "title": "Quy Tac Viet Ten Va Cham Do NNN",
    "namingRules": {
      "inkColor": ["blue", "black"],
      "writeBeforeRecite": true,
      "recipientPatterns": [
        "Oan gia trai chu cua [Ho ten]",
        "Dua tre cua [Ho ten me]",
        "Oan gia trai chu cua ngoi nha cua [Ho ten]"
      ],
      "giverPattern": "[Ho ten nguoi niem]",
      "dateFillRule": "Dien ngay sau khi hoan tat niem va cham do."
    },
    "dottingRules": {
      "dotColor": "red",
      "timingRule": "Chi cham sau khi niem xong.",
      "shapeRule": "Cham vao giua vong tron, khong V/X, khong lem vien.",
      "fillPercentGuideline": "Khoang 80 phan tram dien tich vong tron.",
      "sequenceGuideline": "Uu tien cham tu duoi len tren."
    },
    "errorRecoveryRules": {
      "doNotTear": true,
      "doNotBurnInvalidSheet": true,
      "disposeFlow": [
        "Gach bo thong tin sai.",
        "Gap gon to sai, boc giay sach, bo rac sinh hoat.",
        "Khans xin xac nhan to sai khong con gia tri."
      ],
      "rebuildFlow": [
        "Lay to moi.",
        "Cham lai phan da niem theo dung quy tac."
      ]
    },
    "examples": [
      "To sai ten nguoi nhan -> huy dung flow, khong xé, khong dot.",
      "Cham lem vien -> xu ly nhu to sai, tao to moi."
    ],
    "updatedAt": "2026-03-29T12:00:00Z"
  },
  "littleHouseAllocationGuidelines": {
    "publicId": "ps-lha-0001",
    "slug": "dinh-muc-nnn-theo-tinh-huong",
    "title": "Dinh Muc So To NNN Theo Tinh Huong",
    "baseRange": "Nguoi moi: 4 den 10 to cho Oan gia trai chu cua [Ho ten day du].",
    "scenarioGuidelines": [
      {
        "scenarioCode": "unexplained-body-pain",
        "title": "Dau nhuc khong ro nguyen nhan",
        "suggestedRange": "7 den 9 to",
        "recipientTemplate": "Oan gia trai chu cua [Ho ten]",
        "notes": "Dung nhu dot mo dau, theo doi phan ung va tiep tuc theo thuc te."
      },
      {
        "scenarioCode": "abortion-or-miscarriage",
        "title": "Tung say thai/pha thai",
        "suggestedRange": "7 den 21 to moi thai nhi",
        "recipientTemplate": "Dua tre cua [Ho ten nguoi me]",
        "notes": "So luong thuc te co the cao hon tuy nghiep luc."
      },
      {
        "scenarioCode": "dream-of-deceased",
        "title": "Mo thay nguoi da khuất",
        "suggestedRange": "7 to moi nguoi; thuong can 21+ cho sieu do",
        "recipientTemplate": "[Ho ten nguoi da khuất]",
        "notes": "Neu mo thay nguoi la mac do den: 4 to moi nguoi."
      },
      {
        "scenarioCode": "relationship-conflict",
        "title": "Hoa giai mau thuan",
        "suggestedRange": "7 to/dot, co the lap lai",
        "recipientTemplate": "[Ho ten] hoa giai oan ket",
        "notes": "Danh gia theo tien trinh quan he, khong dot ngot qua tai."
      },
      {
        "scenarioCode": "spirit-in-house",
        "title": "Nha co dau hieu bat on",
        "suggestedRange": "4 den 7 to",
        "recipientTemplate": "Oan gia trai chu cua ngoi nha cua [Ho ten chu nha]",
        "notes": "Ket hop ra soat yeu to ky thuat nha o."
      }
    ],
    "combinationRules": [
      "Neu Le Phat Dai Sam Hoi Van 3 bien/ngay, can duy tri NNN toi thieu tuong ung moi tuan.",
      "Neu tang cuong Le Phat, can tang NNN theo nguyen tac can bang nghiep-khau."
    ],
    "continuityNotes": [
      "NNN la lane duy tri dai han, khong phai one-off.",
      "Khi hoan canh doi (benh vien, vieng mo, xung dot lon), can danh gia va dieu chinh dot moi."
    ],
    "updatedAt": "2026-03-29T12:00:00Z"
  },
  "heartIncense": {
    "publicId": "ps-heart-0001",
    "slug": "tam-huong-9-buoc",
    "title": "Nghi Thuc Tam Huong 9 Buoc",
    "steps": [
      { "stepNumber": 1, "title": "Chuan bi", "action": "Rua tay, chon noi yen tinh, dinh tam.", "mentalOnly": false },
      { "stepNumber": 2, "title": "Tinh khau", "action": "Niem Tinh Khau Nghiep Chan Ngon theo huong dan.", "mentalOnly": false },
      { "stepNumber": 3, "title": "Quan tuong moi huong", "action": "Quan tuong thap den, moi 3 nen huong.", "mentalOnly": true },
      { "stepNumber": 4, "title": "Thinh an", "action": "Niem tham cau thinh an 3 lan.", "mentalOnly": true },
      { "stepNumber": 5, "title": "Quan tuong dang huong", "action": "Quan tuong cam huong vao lu.", "mentalOnly": true },
      { "stepNumber": 6, "title": "Quan tuong le bai", "action": "Quan tuong quy lay 3 lay.", "mentalOnly": true },
      { "stepNumber": 7, "title": "Cam ta", "action": "Niem tham loi cam ta.", "mentalOnly": true },
      { "stepNumber": 8, "title": "Niem That Phat", "action": "Niem 7 bien That Phat Diet Toi Chan Ngon.", "mentalOnly": true },
      { "stepNumber": 9, "title": "Hoan tat", "action": "Quan tuong le ket thuc.", "mentalOnly": true }
    ],
    "travelModeRules": [
      {
        "ruleCode": "mental-visualization-only",
        "label": "Thuc hien bang quan tuong",
        "description": "Ngoai viec chap tay ban dau, cac dong tac dang huong/le bai uu tien thuc hien trong tam.",
        "severity": "critical"
      }
    ],
    "doNotRules": [
      {
        "ruleCode": "no-physical-imitation-without-altar",
        "label": "Khong lam dong tac gia ben ngoai",
        "description": "Tranh thao tac vat ly mo phong khi khong co ban tho phu hop.",
        "severity": "critical"
      },
      {
        "ruleCode": "no-direct-worship-to-random-screen-image",
        "label": "Khong bai lay tuy tien vao hinh man hinh",
        "description": "Hinh anh tren man hinh chi de dinh tam ban dau.",
        "severity": "warning"
      }
    ],
    "littleHouseEmergencyFlow": [
      { "stepNumber": 1, "title": "Dung Tam Huong den buoc thinh an", "action": "Hoan tat buoc 1 den 4 cua Tam Huong.", "mentalOnly": true },
      { "stepNumber": 2, "title": "Niem bo sung", "action": "Niem 1 bien Chu Dai Bi va 1 bien Tam Kinh.", "mentalOnly": false },
      { "stepNumber": 3, "title": "Khans chuyen giao NNN", "action": "Nang NNN ngang tran, khans xin chuyen giao.", "mentalOnly": true },